{"benchmark":{"access_atom_digest":{"algorithm":"sha256","value":"d229287e70a0c5ae60ac1788a5c72d5a1484374d54fc15e5b185269141b7e46b"},"benchmark_family":"contextual_access","benchmark_version":"1.0.0","contextual_public_root_digest":{"algorithm":"sha256","value":"0f8cfa200263982b30a18569c3c8bc4a73626b6cf5d7fec024d27d3bb2e12601"},"enterprise_public_root_digest":{"algorithm":"sha256","value":"b4eae423689ede98d98858cae004f98d07fa5b0ac4774858500a4ba257946f4a"},"identity_access_universe_digest":{"algorithm":"sha256","value":"b4eae423689ede98d98858cae004f98d07fa5b0ac4774858500a4ba257946f4a"},"public_case_inventory_digest":{"algorithm":"sha256","value":"e1f6861f9138643ac4efa9dba5e97af19ebe1a2388fe57947043f192e7968bcf"},"registry_digest":{"algorithm":"sha256","value":"c43430de6741219b688510a8312d8c2b83dd5f3f2d551dd7bd8387fa52d27ea8"},"request_digest":{"algorithm":"sha256","value":"eb9e5365991bd043e5ee301472280ef101edf92c26f909dacb8bdfa2636eefe8"}},"bounds":{"feed_delay_bound_ticks":8,"feed_delay_unit":"tick","post_acceptance_decision_bound_ns":2000000,"post_acceptance_decision_unit":"ns","sut_acceptance_bound_ns":1000000,"sut_acceptance_unit":"ns"},"context_feed_component_ids":["reference-context-feed"],"control_coverage":[{"applicability_rationale":null,"control_id":"SW-CA-C01","disposition":"selected"},{"applicability_rationale":null,"control_id":"SW-CA-C02","disposition":"selected"},{"applicability_rationale":null,"control_id":"SW-CA-C03","disposition":"selected"},{"applicability_rationale":null,"control_id":"SW-CA-C04","disposition":"selected"},{"applicability_rationale":null,"control_id":"SW-CA-C05","disposition":"selected"},{"applicability_rationale":null,"control_id":"SW-CA-C06","disposition":"selected"}],"delivery_attempt_ids":["f49a350b-03c4-5d80-bcfb-098e34f37925","1f4ab460-a7b3-5c46-8fe8-ccd7f5249f85","30ed3519-ef20-59d5-9cf8-5912510388fd","35e6055e-25be-57b7-8bda-da412856e34c","c8f147ea-b6e3-5671-b820-e0a3eb6e79b7","8bd879ae-e736-5477-92f6-e26542ed4b15","9ff206c0-5d3b-5dae-b308-e26efbc61e03","20c794b9-f734-55f2-844f-516a0001e1e0"],"event_ids":["101117d5-ed68-5487-a6e0-8a7163dd0a9f","29ff7032-58c9-5a0d-bc04-3099be0b19c3","300a784e-982e-52e1-9dc0-17a30668be7e","3138b0a7-f9e3-5e5d-a27b-77e18c588027","3456fae8-ce0f-5ae0-84b3-70c435bde77c","396a39e6-8fcb-5da8-8f80-333dbffbbd61","53d80d09-3985-5789-924d-aaab315dfda2"],"event_schedule_version":"contextual-access-schedule-1.0.0","faults":[{"component_id":"reference-context-feed","delivery_attempt_ids":["20c794b9-f734-55f2-844f-516a0001e1e0"],"event_ids":["396a39e6-8fcb-5da8-8f80-333dbffbbd61"],"fault_id":"fault:delayed_delivery","injection_tick":5,"kind":"delayed_delivery","recovery_tick":10},{"component_id":"reference-context-feed","delivery_attempt_ids":["c8f147ea-b6e3-5671-b820-e0a3eb6e79b7","f49a350b-03c4-5d80-bcfb-098e34f37925"],"event_ids":["101117d5-ed68-5487-a6e0-8a7163dd0a9f"],"fault_id":"fault:duplicate_delivery","injection_tick":5,"kind":"duplicate_delivery","recovery_tick":6},{"component_id":"reference-context-feed","delivery_attempt_ids":["8bd879ae-e736-5477-92f6-e26542ed4b15","9ff206c0-5d3b-5dae-b308-e26efbc61e03"],"event_ids":["3138b0a7-f9e3-5e5d-a27b-77e18c588027","53d80d09-3985-5789-924d-aaab315dfda2"],"fault_id":"fault:out_of_order_delivery","injection_tick":5,"kind":"out_of_order_delivery","recovery_tick":7}],"mapping_profile_digest":{"algorithm":"sha256","value":"66ea37967e9726e156382d846a48c5afcc2b0946ef326c2bb782bd6222ff76a7"},"probes":[{"component_id":"reference-contextual-sut","control_id":"SW-CA-C02","probe_id":"probe:decision:0dfae056-71c6-5101-b707-6f26f9e82346","probe_type":"access_decision","request_id":"0dfae056-71c6-5101-b707-6f26f9e82346","trigger_event_id":"300a784e-982e-52e1-9dc0-17a30668be7e"},{"component_id":"reference-contextual-sut","control_id":"SW-CA-C02","probe_id":"probe:decision:1466e3e3-ac93-5fef-8e27-41b60346a7c1","probe_type":"access_decision","request_id":"1466e3e3-ac93-5fef-8e27-41b60346a7c1","trigger_event_id":"3456fae8-ce0f-5ae0-84b3-70c435bde77c"},{"component_id":"reference-contextual-sut","control_id":"SW-CA-C02","probe_id":"probe:decision:266ca67e-4ab6-576c-a0a8-35ac6ef528b6","probe_type":"access_decision","request_id":"266ca67e-4ab6-576c-a0a8-35ac6ef528b6","trigger_event_id":null},{"component_id":"reference-contextual-sut","control_id":"SW-CA-C02","probe_id":"probe:decision:32355049-401c-5336-8694-df3844548ed8","probe_type":"access_decision","request_id":"32355049-401c-5336-8694-df3844548ed8","trigger_event_id":null},{"component_id":"reference-contextual-sut","control_id":"SW-CA-C02","probe_id":"probe:decision:432144a7-90db-5099-ad31-4eeab3ae432f","probe_type":"access_decision","request_id":"432144a7-90db-5099-ad31-4eeab3ae432f","trigger_event_id":"101117d5-ed68-5487-a6e0-8a7163dd0a9f"},{"component_id":"reference-contextual-sut","control_id":"SW-CA-C02","probe_id":"probe:decision:521020ba-83c0-5b20-bcbe-245f4cd00f4e","probe_type":"access_decision","request_id":"521020ba-83c0-5b20-bcbe-245f4cd00f4e","trigger_event_id":"29ff7032-58c9-5a0d-bc04-3099be0b19c3"},{"component_id":"reference-contextual-sut","control_id":"SW-CA-C02","probe_id":"probe:decision:85b49a5e-9fbe-529e-a0cf-d12a3e4ec5c8","probe_type":"access_decision","request_id":"85b49a5e-9fbe-529e-a0cf-d12a3e4ec5c8","trigger_event_id":null},{"component_id":"reference-contextual-sut","control_id":"SW-CA-C02","probe_id":"probe:decision:a8f2be95-b5bf-5bd0-a624-8f459f0f6ca7","probe_type":"access_decision","request_id":"a8f2be95-b5bf-5bd0-a624-8f459f0f6ca7","trigger_event_id":"396a39e6-8fcb-5da8-8f80-333dbffbbd61"},{"component_id":"reference-contextual-sut","control_id":"SW-CA-C02","probe_id":"probe:decision:cf3c46f9-1a6f-5533-9be1-897dea33a1cc","probe_type":"access_decision","request_id":"cf3c46f9-1a6f-5533-9be1-897dea33a1cc","trigger_event_id":null},{"component_id":"reference-contextual-sut","control_id":"SW-CA-C02","probe_id":"probe:decision:ebd16901-8625-5729-8986-ecf17440e5f4","probe_type":"access_decision","request_id":"ebd16901-8625-5729-8986-ecf17440e5f4","trigger_event_id":"3138b0a7-f9e3-5e5d-a27b-77e18c588027"},{"component_id":"reference-context-feed","control_id":"SW-CA-C04","delivery_attempt_id":"1f4ab460-a7b3-5c46-8fe8-ccd7f5249f85","event_id":"29ff7032-58c9-5a0d-bc04-3099be0b19c3","probe_id":"probe:delivery:1f4ab460-a7b3-5c46-8fe8-ccd7f5249f85","probe_type":"delivery_acceptance"},{"component_id":"reference-context-feed","control_id":"SW-CA-C04","delivery_attempt_id":"20c794b9-f734-55f2-844f-516a0001e1e0","event_id":"396a39e6-8fcb-5da8-8f80-333dbffbbd61","probe_id":"probe:delivery:20c794b9-f734-55f2-844f-516a0001e1e0","probe_type":"delivery_acceptance"},{"component_id":"reference-context-feed","control_id":"SW-CA-C04","delivery_attempt_id":"30ed3519-ef20-59d5-9cf8-5912510388fd","event_id":"300a784e-982e-52e1-9dc0-17a30668be7e","probe_id":"probe:delivery:30ed3519-ef20-59d5-9cf8-5912510388fd","probe_type":"delivery_acceptance"},{"component_id":"reference-context-feed","control_id":"SW-CA-C04","delivery_attempt_id":"35e6055e-25be-57b7-8bda-da412856e34c","event_id":"3456fae8-ce0f-5ae0-84b3-70c435bde77c","probe_id":"probe:delivery:35e6055e-25be-57b7-8bda-da412856e34c","probe_type":"delivery_acceptance"},{"component_id":"reference-context-feed","control_id":"SW-CA-C04","delivery_attempt_id":"8bd879ae-e736-5477-92f6-e26542ed4b15","event_id":"53d80d09-3985-5789-924d-aaab315dfda2","probe_id":"probe:delivery:8bd879ae-e736-5477-92f6-e26542ed4b15","probe_type":"delivery_acceptance"},{"component_id":"reference-context-feed","control_id":"SW-CA-C04","delivery_attempt_id":"9ff206c0-5d3b-5dae-b308-e26efbc61e03","event_id":"3138b0a7-f9e3-5e5d-a27b-77e18c588027","probe_id":"probe:delivery:9ff206c0-5d3b-5dae-b308-e26efbc61e03","probe_type":"delivery_acceptance"},{"component_id":"reference-context-feed","control_id":"SW-CA-C04","delivery_attempt_id":"c8f147ea-b6e3-5671-b820-e0a3eb6e79b7","event_id":"101117d5-ed68-5487-a6e0-8a7163dd0a9f","probe_id":"probe:delivery:c8f147ea-b6e3-5671-b820-e0a3eb6e79b7","probe_type":"delivery_acceptance"},{"component_id":"reference-context-feed","control_id":"SW-CA-C04","delivery_attempt_id":"f49a350b-03c4-5d80-bcfb-098e34f37925","event_id":"101117d5-ed68-5487-a6e0-8a7163dd0a9f","probe_id":"probe:delivery:f49a350b-03c4-5d80-bcfb-098e34f37925","probe_type":"delivery_acceptance"},{"component_id":"reference-contextual-sut","control_id":"SW-CA-C03","probe_id":"probe:enforcement:0dfae056-71c6-5101-b707-6f26f9e82346","probe_type":"protected_enforcement","request_id":"0dfae056-71c6-5101-b707-6f26f9e82346"},{"component_id":"reference-contextual-sut","control_id":"SW-CA-C03","probe_id":"probe:enforcement:1466e3e3-ac93-5fef-8e27-41b60346a7c1","probe_type":"protected_enforcement","request_id":"1466e3e3-ac93-5fef-8e27-41b60346a7c1"},{"component_id":"reference-contextual-sut","control_id":"SW-CA-C03","probe_id":"probe:enforcement:266ca67e-4ab6-576c-a0a8-35ac6ef528b6","probe_type":"protected_enforcement","request_id":"266ca67e-4ab6-576c-a0a8-35ac6ef528b6"},{"component_id":"reference-contextual-sut","control_id":"SW-CA-C03","probe_id":"probe:enforcement:32355049-401c-5336-8694-df3844548ed8","probe_type":"protected_enforcement","request_id":"32355049-401c-5336-8694-df3844548ed8"},{"component_id":"reference-contextual-sut","control_id":"SW-CA-C03","probe_id":"probe:enforcement:432144a7-90db-5099-ad31-4eeab3ae432f","probe_type":"protected_enforcement","request_id":"432144a7-90db-5099-ad31-4eeab3ae432f"},{"component_id":"reference-contextual-sut","control_id":"SW-CA-C03","probe_id":"probe:enforcement:521020ba-83c0-5b20-bcbe-245f4cd00f4e","probe_type":"protected_enforcement","request_id":"521020ba-83c0-5b20-bcbe-245f4cd00f4e"},{"component_id":"reference-contextual-sut","control_id":"SW-CA-C03","probe_id":"probe:enforcement:85b49a5e-9fbe-529e-a0cf-d12a3e4ec5c8","probe_type":"protected_enforcement","request_id":"85b49a5e-9fbe-529e-a0cf-d12a3e4ec5c8"},{"component_id":"reference-contextual-sut","control_id":"SW-CA-C03","probe_id":"probe:enforcement:a8f2be95-b5bf-5